{
  "$schema": "https://json-schema.org/draft/2020-12/schema",
  "$id": "https://savi.seo/contracts/sync/v1/events/conversation.schema.json",
  "title": "Evento conversation/1 - una conversacion creada",
  "type": "object",
  "required": ["schema", "source_id", "occurred_at", "data"],
  "properties": {
    "schema": { "const": "conversation/1" },
    "source_id": { "type": "string", "minLength": 1, "maxLength": 128 },
    "occurred_at": {
      "type": "string",
      "pattern": "^[0-9]{4}-[0-9]{2}-[0-9]{2}T[0-9]{2}:[0-9]{2}:[0-9]{2}(\\.[0-9]{1,6})?(Z|[+-][0-9]{2}:[0-9]{2})$"
    },
    "data": {
      "type": "object",
      "additionalProperties": false,
      "required": ["conversation_ref", "user_ref"],
      "properties": {
        "conversation_ref": {
          "type": "string",
          "pattern": "^[0-9a-fA-F]{8}-[0-9a-fA-F]{4}-[0-9a-fA-F]{4}-[0-9a-fA-F]{4}-[0-9a-fA-F]{12}$"
        },
        "database_ref": {
          "type": ["string", "null"],
          "pattern": "^[0-9a-fA-F]{8}-[0-9a-fA-F]{4}-[0-9a-fA-F]{4}-[0-9a-fA-F]{4}-[0-9a-fA-F]{12}$"
        },
        "user_ref": { "type": "string", "pattern": "^[0-9a-f]{32}$" }
      }
    }
  }
}
